,PEAKID,PKNAME,PKNAME2,LOCATION,HEIGHTM,HEIGHTF,HIMAL,REGION,OPEN,UNLISTED,TREKKING,TREKYEAR,RESTRICT,PHOST,PSTATUS,PEAKMEMO,PYEAR,PSEASON,PEXPID,PSMTDATE,PCOUNTRY,PSUMMITERS,PSMTNOTE,REFERMEMO,PHOTOMEMO,firstsummitdate,Unnamed: 0,accuracy,formatted_address,google_place_id,latitude,longitude,number_of_results,postcode,status,type
320,KAKU,Kang Kuru,,"Mustang Himal (NNE of Tsartse, WSW of Ghami village)",6344,20814,16,6,False,True,False,,,1,2,,2008,1,KAKU08101,Apr 16,USA,"Peter Athans, Theodore Hessler",,,,Apr 16 2008,320,APPROXIMATE,"Kangkuru, 8481, South Africa",ChIJs0bhmDPZnh4R34ZEzLYLsak,28.9,84.188333,1,8481,OK,"locality,political"
321,AMPM,Amphu Middle,Amphu North,Khumbu Himal (NE of Amphu Laptsa),6202,20348,12,2,False,True,False,,Requires permit for Amphu I,1,2,,2008,1,AMPM08101,Apr 20,Germany,"Olaf Rieck, Alexander Graeber",,,,Apr 20 2008,321,ROOFTOP,"315 E Prince Rd, Tucson, AZ 85705, USA",ChIJd9sgqt5z1oYRf8x9SXJFoAs,,,1,85705,OK,"establishment,point_of_interest,school"
322,LUGU,Lugula,,Damodar Himal (E of Bhrikuti Sail on Tibetan border),6899,22635,3,5,True,False,False,,Opened in 2014,4,2,,2010,3,LUGU10301,Nov 02,France,Renald Guillaune,1st official ascent in Spring 2014 by S Koreans,,,Nov 02 2010,322,,,,28.896111,84.261667,0,,ZERO_RESULTS,
323,BHRS,Bhrikuti Shail,,Damodar Himal (NE of Thorong La on Tibetan border),6361,20869,3,5,True,False,False,,,4,2,,2005,1,BHRS05101,May 16,"France, Nepal","Paulo Grobel, Denis Flaven, Bikram Singh",,,,May 16 2005,323,,,,28.898,84.201,0,,ZERO_RESULTS,
324,MYAG,Myagdi Matha,,Dhaulagiri Himal (S of Dhaulagiri IV),6273,20581,4,6,False,True,False,,,1,1,,0,0,,,,Unclimbed?,,,,,324,,,,28.6642,83.323,0,,ZERO_RESULTS,
325,TOBS,Tobsar,Tabsar,Shringi Himal (ENE of Chamar),6065,19898,5,4,True,False,False,,Opened in 2002,1,1,,0,0,,,,Unclimbed,,,,,325,APPROXIMATE,"09133 Tobar, Burgos, Spain",ChIJ8as4eoenSA0RvLdlhmyc4UE,28.594722,85.005278,1,09133,OK,"locality,political"
326,DINS,Dingjung Ri,Dingjung Ri South,Rolwaling Himal (S of Pangbuk Ri on Tibetan border),6196,20328,19,2,True,False,False,,Opened in 2002,4,2,,2008,1,DINS08101,Mar 15,Japan,"Kenro Nakajima, Hiroki Yamamoto",1st known ascent (may be others earlier),,,Mar 15 2008,326,,,,27.973056,86.523333,0,,ZERO_RESULTS,
327,DUDH,Dudh Kundali,"Dui Tal Chuli, Two Lakes Peak",Jagdula Lekh (S of Kanjiroba Himal),6045,19833,10,7,True,False,False,,,1,2,,1953,3,DUDH53301,Nov,"Austria, Nepal, India","Herbert Tichy, Ajiba Sherpa, Gyalzen Sherpa, Pasang Dawa Lama, Pemba Sherpa",,,,Nov 1953,327,ROOFTOP,"2206, Kamshet - Kundali Rd, Kamshet, Maharashtra 410405, India",ChIJyeSbq3eswjsRMCmnXHNLcHc,29.223889,82.545556,1,410405,OK,"establishment,food,point_of_interest"
328,KAGA,Kanta Gaton,Kangfu Gaton,Kanjiroba Himal (SE of Phoksumdo Tal),5910,19390,10,7,True,False,False,,Opened in 2002,1,2,,2009,2,KAGA09201,Aug 16,"France, Nepal","Jean-Rene Minelli, Abel Minelli, Eienne Minelli, Sarah Minelli, Pemba Jangbu Sherpa",1st official ascent,,,Aug 16 2009,328,,,,29.103333,82.995833,0,,ZERO_RESULTS,
329,KAPT,Kaptang,,Kanti Himal (NW of Kanti Himal peak on Tibetan border),5965,19570,11,7,True,False,False,,Opened in 2002,4,2,,2009,3,KAPT09201,Jun 09,"Japan, Nepal","Tamotsu Ohnishi, Toshitsugi Irizawa, Gombu Sherpa",,,,Jun 09 2009,329,GEOMETRIC_CENTER,"By Pass Road, Dhorra By Pass, Dhaurra Mafi, Dhorra, Jamalpur Ka Nagla, Aligarh, Uttar Pradesh 202001, India",ChIJkbp4ECKldDkR9qOT0gzoAUk,29.926389,82.575556,1,202001,OK,"establishment,food,point_of_interest,store"
330,ROMA,Roma,,Saipal Himal (SW of Saipal),5407,17740,20,7,True,False,False,,Delisted in 2014,1,1,,0,0,,,,Unclimbed?,,,,,330,ROOFTOP,"6027 S Sheridan Rd, Tulsa, OK 74145, USA",ChIJbfDRLYeStocR8hu2AF1Lxqk,29.798611,81.345278,1,74145,OK,"establishment,food,point_of_interest,restaurant"
331,RIPI,Ripimo Shar,"Khang Karpo, Kang Karpo",Rolwaling Himal (S of Dingjung Ri on Tibetan border),6647,21808,19,2,True,False,False,,Opened in 2014 (as Khang Karpo),4,2,,1952,1,RIPI52101,May 29,UK,"Tom Bourdillon, Ray Colledge",,,,May 29 1952,331,,,,27.873056,86.518056,0,,ZERO_RESULTS,
332,TSIS,Tsisima,"Chijima, MDM Peak",Janak Himal (WSW of Janak Chuli),6196,20328,6,1,False,True,False,,,1,2,,1963,1,TSIS63101,Jun 03,"Japan, Nepal","Motohiko Kogo, Kunga Norbu",,,,Jun 03 1963,332,APPROXIMATE,"Tsushima, Japan",ChIJRY3L002daTURAoTvZbwvOCs,27.843611,88.152778,1,,OK,"establishment,natural_feature"
333,TAWA,Tawa,,Damodar Himal (NNE of Yakawa Kang),6110,20046,3,5,False,True,False,,,1,2,,2010,3,TAWA10301,Oct 21,"Japan, Nepal","Mikio Iga, Kazuya Fujikura, Chhongba Sherpa, Lhakpa Sherpa",,,,Oct 21 2010,333,ROOFTOP,"487 Glenbrook Rd, Stamford, CT 06906, USA",ChIJ93iTp7GhwokRJo3-cNDrXSc,,,1,06906,OK,"establishment,food,point_of_interest,restaurant"
334,URMA,Urkema,"Baden Powell Scout Peak, Urgyenma",Langtang Himal (W of Ganja La),5890,19324,13,3,True,False,False,,,1,2,,2007,3,URMA07301,Sep 12,"Taiwan, S Korea, Singapore, Australia, Nepal",15 international scout students and 6 Sherpas,,,,Sep 12 2007,334,ROOFTOP,"100 PA-413, Bristol, PA 19007, USA",ChIJlYtrY3ZOwYkRmWVJkVjwLBA,28.166389,85.533611,1,19007,OK,"establishment,point_of_interest"
335,MPNW,Manapathi NW,,"Dhaulagiri Himal (SSW of Dhaulagiri I, NW of Manapathi)",6384,20945,4,6,False,True,False,,,1,2,,1977,1,MPNW77101,Apr 20,"Italy, UK, W Germany","Reinhold Messner, Leo Dickinson, Eric Jones, Otto Wiedemann",,,,Apr 20 1977,335,APPROXIMATE,"Manampathi, Tamil Nadu 603403, India",ChIJ06neezjfUjoR-NvmBEv2nB4,28.645556,83.458333,1,603403,OK,"locality,political"
336,LUNR,Lunag Ri,"Lunag I, Rongshar Ri I, Ondrej Peak",Rolwaling Himal (SW of Nangpa La on Tibetan border),6895,22621,19,2,False,True,False,,Requires permit for Jobo Rinjang,4,1,,0,0,,,,Unclimbed,,,,,336,,,,28.050556,86.551111,0,,ZERO_RESULTS,
337,JASG,Jasemba Goth,Dzasampa Kang,Khumbu Himal (NW of Pasang Lhamu Chuli),6730,22080,12,2,True,False,False,,Opened in 2014,1,2,,1964,1,JASG64101,Apr 08,W Germany,"Georg Huber, Fritz Stammberger",,,,Apr 08 1964,337,,,,28.087222,86.605,0,,ZERO_RESULTS,
338,GOJN,Gojung,Mugu Chuli,Kanti Himal (WNW of Kanti Himal peak on Tibetan border),6310,20702,11,7,False,True,False,,,4,2,,2011,3,GOJN11301,Oct 19,UK,"Mick Fowler, Dave Turnbull",,,,Oct 19 2011,338,GEOMETRIC_CENTER,"1 Jalan Anak Bukit, #L1-CA2 Bukit Timah Plaza, Singapore 588996",ChIJs12GA4kQ2jERHpp_wOoQRBM,29.847895,82.622778,1,588996,OK,"establishment,food,point_of_interest,store"
339,NAN2,Nangamari II,,Ohmi Kangri Himal (S of Nangamari I),6209,20371,6,1,True,False,False,,,1,2,,2016,3,NAN216301,Oct 17,Japan,"Tsuneo Shigehiro, Kensuke Iwai, Kiyo Kuroda, Shiro Matsunaka, Yusuke Morimoto, Kanji Totegi, Miyoko Nagase, Masayuki Takenaka, Saori Tatsuno",,,,Oct 17 2016,339,,,,27.891389,87.866667,0,,ZERO_RESULTS,
340,DRAG,Dragmorpa Ri,"Thakmarpo Ri, Panaya Tippa",Langtang Himal (SW of Tilman's Col on Tibetan border),6185,20292,13,3,True,False,False,,,4,2,,2013,1,DRAG13101,May 30,Russia,Roman Gretzky,Did Gretzky climb Dagmorpa Ri or Paniyo Tippa in Khumbu?,,,May 30 2013,340,,,,28.325278,85.666111,0,,ZERO_RESULTS,
341,SYKG,Syaokang,,Ohmi Kangri Himal (SW of Ohmi Kangri near Tibetan border),5929,19452,6,1,True,False,False,,,1,2,,2012,3,SYKG12301,Oct 25,New Zealand,"John Cocks, Martin Hunter, Geoffrey Lamarche, Paul Maxim, Nick Schearer",,,,Oct 25 2012,341,GEOMETRIC_CENTER,"Shaokang Street, Qianzhen District, Kaohsiung City, Taiwan 806",ChIJK0UC6WMDbjQReBS8lFldVyk,27.863889,87.919444,1,806,OK,route
342,BIJO,Bijora Hiunchuli,,Jagdula Lekh (S of Kande Huinchuli),6111,20049,10,7,True,False,False,,Opened in 2014,1,1,,0,0,,,,Unclimbed,,,,,342,,,,29.291944,82.530833,0,,ZERO_RESULTS,
343,CHUB,Chhuboche,,Damodar Himal (NNE of Pisang Peak),5606,18392,3,5,True,False,False,,,1,2,,2013,3,CHUB13301,Nov 16,UK,"Brian Jackson, Hugh Wrightson, Pasang Sherpa, Tendi Wangya",,,,Nov 16 2013,343,,,,28.720278,84.2375,0,,ZERO_RESULTS,
344,LUNW,Lunag West,,Rolwaling Himal (W of Lunag I on Tibetan border),6492,21299,19,2,False,True,False,,Requires permit for Jobo Rinjang,4,2,,2013,3,LUNW13301,Oct 22,USA,"Scott Adamson, Chris Wright",,,,Oct 22 2013,344,GEOMETRIC_CENTER,"Lunar Ct, West Lafayette, IN 47906, USA",ChIJYxU7x3v8EogR5Pr_Zozy26s,28.05,86.536,1,47906,OK,route
345,DOMO,Domo,Jongsang SE Peak,Jongsang Himal (SE of Jongsong on Indian border),7447,24432,7,1,False,True,False,,,5,2,,1930,1,DOMO30101,Jun 08,"Germany, Nepal","Guenter Dyhrenfurth, Lewa Sherpa",,,,Jun 08 1930,345,ROOFTOP,"6322 Brookside Plaza, Kansas City, MO 64113, USA",ChIJLQIMMw7vwIcRd16YUf_6sFE,27.8833,88.15,1,64113,OK,"bar,establishment,food,point_of_interest,restaurant"
346,LUN2,Lunag II,,Rolwaling Himal (SW of Nangpa La near Tibetan border),6812,22349,19,2,False,True,False,,Requires permit for Jobo Rinjang,1,2,,2010,3,LUN210301,Oct 26,France,"Mathieu Detrie, Max Belleville, Mathiew Maynadier, Sebastien Ratel",,,,Oct 26 2010,346,GEOMETRIC_CENTER,"Lunar St, Scottsburg, IN 47170, USA",ChIJP1enwPvaa4gRDVaZdO3kNyU,,,10,47170,OK,route
347,TRIA,Triangle Peak,,Jugal Himal (NNW of Dome Blanc on Tibetan border),6484,21273,8,3,False,True,False,,,4,2,,2013,3,TRIA13301,Oct 09,France,"Sebastien Moatti, Max Bonniot",Climbed from Tibetan side,,,Oct 09 2013,347,,,,,,0,,ZERO_RESULTS,
348,KASI,Kasi Dalpha,,Jagdula Lekh (S of Kande Huinchuli),6386,20951,10,7,True,False,False,,Opened in 2014,1,1,,0,0,,,,Unclimbed,,,,,348,,,,29.283056,82.554722,0,,ZERO_RESULTS,
349,NPHU,Narphu,,"Damodar Himal (WNW of Pisang Peak, E of Chulu East Peak)",5921,19426,3,5,True,False,False,,,1,2,,2014,3,NPHU14301,Nov 22,"UK, Nepal","Brian Jackson, Heather Bentley, Catherine Husted, Dawn Richardson, James Salt, Rhiannon Thomson, Mingma Dorje Sherpa, Pasang Sherpa Shikhar Pandey",1st official ascent,,,Nov 22 2014,349,APPROXIMATE,"Narphu, Bhutan",ChIJQ5E_XkqNWzcRn5Mbr16BzJI,28.659722,84.174444,1,,OK,"locality,political"
350,POTA,Pota Himal North,Peak Hawley,Dhaulagiri Himal (NE of Putha Hiunchuli),6182,20282,4,6,True,False,False,,Opened in 2014,1,2,,2008,1,POTA08101,May 09,France,Francois Damilano,,,,May 09 2008,350,GEOMETRIC_CENTER,"Jessore Road, Madhyamgram, Vivekananda Nagar, Madhyamgram, Near Badu Road Crossing, West Bengal 700129, India",ChIJ8fvgsEWf-DkRIDmMGOuwIiY,28.775833,83.1975,1,700129,OK,"establishment,point_of_interest"
351,PANN,Pangbuk North,Jobo LeCoultre,Rolwaling Himal (NE of Pangbuk Ri on Tibetan border),6478,21253,19,2,False,True,False,,,4,2,,2013,3,PANN13301,Nov 01,USA,"Scott Adamson, Christopher Wright",,,,Nov 01 2013,351,,,,,,0,,ZERO_RESULTS,
352,MUST,Mustang Himal,,Mustang Himal (S of Mansail on Tibetan border),6195,20325,16,6,True,False,False,,Opened in 2014,1,2,,2014,3,MUST14301,Nov 02,USA,"Melissa Arnot, Ben Jones, Jon Mancuso",,,,Nov 02 2014,352,APPROXIMATE,"Mustangbhot Himal, Zhongba, Xigaze, China, 33100",ChIJfcKeTKdXvjkRIZjh7UVqpB0,29.286111,83.81,1,33100,OK,"establishment,natural_feature"
353,MNSL,Mansail,Manshail,Mustang Himal (NW of Lo Manthang on Tibetan border),6235,20456,16,6,True,False,False,,Opened in 2014,1,2,,2014,3,MNSL14301,Sep 29,Japan,"Yukiko Inoue, Eri Hasegawa, Mariko Nakamura, Kei Taniguchi",,,,Sep 29 2014,353,GEOMETRIC_CENTER,"Boat Harbour NSW 2316, Australia",ChIJJ7Udjs2Cc2sR6-XoNpj8BYU,29.301944,83.810278,1,2316,OK,"bus_station,establishment,point_of_interest,transit_station"
354,CPHU,Chhochenphu Himal,,Ohmi Kangri Himal (SW of Pabuk Kang near Tibetan border),6260,20538,6,1,True,False,False,,Opened in 2014,1,1,,0,0,,,,Unclimbed,,,,,354,,,,27.831944,87.767222,0,,ZERO_RESULTS,
355,TANK,Tankya I,,Kanti Himal (NE of Mariyang on Tibetan border),6305,20686,11,7,True,False,False,,Opened in 2014,4,1,,0,0,,,,Unclimbed,,,,,355,GEOMETRIC_CENTER,"86/20 ซอยหอพักคุณหญิงอิศรา ถนนงามวงศ์วาน ซอยงามวงศ์วาน 46, ลาดยาว, จตุจักร, Bangkok 10900, Thailand",ChIJY8aAXOac4jARx49VBachRLo,29.706111,82.916944,1,10900,OK,"establishment,food,grocery_or_supermarket,point_of_interest,store"
356,GORK,Gorakh Khang,,Gorakh Khang (ENE of Simikot on Tibetan border),6254,20518,17,7,True,False,False,,Opened in 2014,4,1,,0,0,,,,Unclimbed,,,,,356,,,,30.044167,82.3375,0,,ZERO_RESULTS,
357,RAUN,Raungsiyar,,Rolwaling Himal (N of Pimu),6224,20420,19,2,True,False,False,,Opened in 2014,1,2,,2015,3,RAUN15301,Oct 04,Nepal,"Dawa Gyalje Sherpa, Nima Tenji Sherpa, Tashi Sherpa",,,,Oct 04 2015,357,ROOFTOP,"6401 France Ave S, Minneapolis, MN 55435, USA",ChIJqZad0rom9ocROGwxD-IENUk,27.907778,86.559444,2,55435,OK,"doctor,establishment,health,point_of_interest"
358,LDAK,Langdak,,Rolwaling Himal (N of Raungsiyar and Pimu),6220,20407,19,2,True,False,False,,Opened in 2014,1,2,,2015,3,LDAK15301,Oct 05,Nepal,"Dawa Gyalje Sherpa, Nima Tenji Sherpa, Tashi Sherpa",,,,Oct 05 2015,358,APPROXIMATE,"Landak Regency, West Kalimantan, Indonesia",ChIJc2KDMSIp_TERHg8Ta5ZrGrI,27.916944,86.563611,2,,OK,"administrative_area_level_2,political"
359,TKRE,Takargo East,"Thakar Go East, Dragker-go East",Rolwaling Himal (ESE of Takargo),6152,20184,19,2,True,False,False,,Opened in 2014,1,2,,2015,3,TKRE15301,Oct 06,Nepal,"Dawa Gyalje Sherpa, Nima Tenji Sherpa, Tashi Sherpa",,,,Oct 06 2015,359,,,,27.871944,86.523333,0,,ZERO_RESULTS,
360,OMIT,Omitso Go,Omi Tso Go,Rolwaling Himal (NE of Kang Nachugo on Tibetan border),6332,20774,19,2,True,False,False,,Opened in 2014,4,1,,0,0,,,,Unclimbed,,,,,360,,,,27.915278,86.458056,0,,ZERO_RESULTS,
361,CBAM,Chhopa Bamare,Chomo Pamari,Rolwaling Himal (NW of Lamabagar on Tibetan border),6109,20043,19,2,True,False,False,,Opened in 2014,4,1,,0,0,,,,Unclimbed,,,,,361,,,,28.057222,86.091944,0,,ZERO_RESULTS,
362,YALW,Yalung Kang West,,Kangchenjunga Himal (W summit of Yalung Kang),8077,26499,9,1,True,False,False,,Opened in 2014,1,1,,0,0,,,,Unclimbed,,,,,362,APPROXIMATE,Jalung Kang,ChIJ3UKSHDdY5jkRJGyibMOk2Ks,27.706111,88.125556,1,,OK,"establishment,natural_feature"
363,KANN,Kangchenjunga North,,Kangchenjunga Himal (small knob north of Main summit),7938,26043,9,1,True,False,False,,Opened in 2014,5,1,,0,0,,,,Unclimbed?,Possibly traversed on KANG ascents from north,,,,363,APPROXIMATE,Kangchenjunga,ChIJU4iVF0pY5jkRTG3ch4BEb3E,27.7024914,88.147535,1,,OK,"establishment,natural_feature"
364,KBNE,Kangbachen East,Kambachen East,Kangchenjunga Himal (plateau SE of Kangbachen?),7780,25525,9,1,True,False,False,,Opened in 2014,1,1,,0,0,,,,Unclimbed,,,,,364,APPROXIMATE,"Kangbachen, Lelep 57500, Nepal",ChIJyS7RkN1Z5jkR9Ac5bCcoHH0,27.7166,88.1105,1,57500,OK,"establishment,natural_feature"
365,HERZ,Herzog Peak,Khangsar Khang West,Annapurna Himal (WSW of Roc Noir),7555,24787,1,5,True,False,False,,Opened in 2014,1,2,,0,0,,,,Climbed?,Likely climbed on traverses to ANNE,,,,365,,,,28.609167,83.860278,0,,ZERO_RESULTS,
366,GANW,Gangapurna West,"Lachenal Peak, Asapurna",Annapurna Himal (W of Gangapurna),7140,23425,1,5,True,False,False,,Opened in 2014,1,1,,0,0,,,,Unclimbed?,,,,,366,APPROXIMATE,"Gangapurna, 33500, Nepal",ChIJ1zwrz7whvjkRL6G_qZCrPn4,28.601111,83.943889,1,33500,OK,"establishment,natural_feature"
367,CHMR,Chamar,Shringi Himal,Shringi Himal (SSE of Chamar),7161,23494,5,4,True,False,False,,,1,1,,0,0,,,,Unclimbed?,,,,,367,,,,28.555278,84.946667,0,,ZERO_RESULTS,
368,NGAP,Nepal Gap Peak,Nepal Gyap Peak,Kangchenjunga Himal (ENE of Gimmegela on Indian border),7007,22989,9,1,True,False,False,,Opened in 2014,5,1,,0,0,,,,Unclimbed?,,,,,368,,,,27.746389,88.180833,0,,ZERO_RESULTS,
369,GAUS,Gaurishankar South,Gauri,Rolwaling Himal (S of Gaurishankar),7010,22999,19,2,True,False,False,,Opened in 2014,1,2,,1979,3,GAUS79301,Nov 09,UK,"Peter Boardman, Pemba Lama, Timothy Leach, Guy Neithardt",,,,Nov 09 1979,369,APPROXIMATE,"Gauri Sankar, 45500, Nepal",ChIJbW0Mj16B6TkRRntZizeuw0Q,27.95,86.3333333,1,45500,OK,"establishment,natural_feature"
370,BURK,Burke Kang,Burke Khang,Khumbu Himal (ENE of Hungchhi on Tibetan border),6942,22776,12,2,True,False,False,,Opened in 2014,4,1,,0,0,,,,Unclimbed,,,,,370,,,,28.036944,86.773889,0,,ZERO_RESULTS,
371,HMLE,Himlung East,,Peri Himal (E of Himlung Himal on Tibetan border),6932,22743,18,5,True,False,False,,Opened in 2014,4,2,,2017,1,HMLE17101,May 08,"France, Nepal","Paulo Grobel, Isabelle Guillaume, Rajan Lama Bhote, Jangbu Sherpa",,,,May 08 2017,371,,,,28.769167,84.438889,0,,ZERO_RESULTS,
372,YNGS,Yangra Kangri South,"Yangra South, Ganesh I South",Ganesh Himal (NW of Ganesh III on Tibetan border),6863,22516,5,4,True,False,False,,Opened in 2014,4,1,,0,0,,,,Unclimbed?,,,,,372,APPROXIMATE,Yangra,ChIJi8CG2cm66jkR92TnM6OJTwg,28.346389,85.11,1,,OK,"establishment,natural_feature"
373,NUPL,Nup La Kang,Nupla Khang,Khumbu Himal (N of Nup La on Tibetan border),6861,22510,12,2,True,False,False,,Opened in 2014,4,1,,0,0,,,,Unclimbed,,,,,373,,,,28.074167,86.766944,0,,ZERO_RESULTS,
374,CHUM,Chumbu,,Khumbu Himal (WSW of Khangri Shar near Tibetan border),6859,22503,12,2,True,False,False,,Opened in 2014,1,1,,0,0,,,,Unclimbed,,,,,374,GEOMETRIC_CENTER,"Chumbu Rd, Chingola, Zambia",ChIJvzMNBtSobRkRYY_7s2U5eSg,28.018889,86.7925,1,,OK,route
375,PHUG,Phu Kang Go,"Phu Khang Go, Athahra Saya Khola Himal",Peri Himal (SE of Cheo on Tibetan border),6767,22201,18,5,True,False,False,,Opened in 2014,4,2,,2011,3,PHUG11301,Oct 27,"France, Belgium","Paulo Grobel, Benoit Van Lerberghe",,,,Oct 27 2011,375,ROOFTOP,"5201 NJ-38, Merchantville, NJ 08109, USA",ChIJEQTkRmPJxokRy4Z9khqpQD0,28.734722,84.493889,1,08109,OK,"establishment,food,point_of_interest,restaurant"
376,GURA,Guras,,Guras Himal (NE of Nampa on Tibetan border),6744,22126,2,7,True,False,False,,Opened in 2014,4,1,,0,0,,,,Unclimbed,,,,,376,ROOFTOP,"5530 13400 S, Herriman, UT 84096, USA",ChIJ-aQXs-CEUocRES2LY1NkiS4,30.043056,81.108889,1,84096,OK,"establishment,food,point_of_interest,restaurant"
377,THRK,Tharke Kang,Tharke Khang,Khumbu Himal (S of Nup La on Tibetan border),6710,22014,12,2,True,False,False,,Opened in 2014,4,1,,0,0,,,,Unclimbed,,,,,377,,,,28.043889,86.751667,0,,ZERO_RESULTS,
378,HUGO,Hulang Go,,Peri Himal (WNW of Ratna Chuli on Tibetan border),6687,21939,18,5,True,False,False,,Opened in 2014,5,1,,0,0,,,,Unclimbed,,,,,378,,,,28.872778,84.345556,0,,ZERO_RESULTS,
379,SHNW,Shershon Northwest,,Makalu Himal (NW of Shershon on Tibetan border),6682,21923,14,2,True,False,False,,Opened in 2014,4,2,,1980,3,SHNW80301,Oct 15,"UK, France","Doug Scott, Roger Baxter-Jones, Georges Bettembourg",,,,Oct 15 1980,379,APPROXIMATE,"Shershon, 56900, Nepal",ChIJ7cwBT0j36DkR4UQrbnRXMUg,27.855278,87.110833,1,56900,OK,"neighborhood,political"
380,AGLE,Agole East,Angole East,Rolwaling Himal (E of Tengi Ragi Tau),6675,21900,19,2,True,False,False,,Opened in 2014,1,1,,0,0,,,,Unclimbed,,,,,380,ROOFTOP,"330 Townsend St, San Francisco, CA 94107, USA",ChIJMZRbK9R_j4ARICcvBjze6Yc,27.850278,86.563611,1,94107,OK,"establishment,point_of_interest"
381,ROLK,Rolwaling Kang,Rolwaling Khang,Rolwaling Himal (NNE of Tarkago),6664,21864,19,2,True,False,False,,Opened in 2014,1,2,,2016,3,ROLK16301,Oct 19,Japan,"Yasuhiro Hanatani, Yuichiro Iida, Maho Ishio, Yohei Kayama, Keisuke Tsunoda, Takuya Yoshikawa",,,,Oct 19 2016,381,,,,27.8975,86.523056,0,,ZERO_RESULTS,
382,YARW,Yarwa,,Guras Himal (NW of Nampa on Tibetan border),6644,21798,2,7,True,False,False,,Opened in 2014,1,1,,0,0,,,,Unclimbed,,,,,382,GEOMETRIC_CENTER,"Yarwa Road, Jimeta, Nigeria",ChIJ_c2nod9q_BARWc0voiFdFe8,30.054167,81.0925,1,,OK,route
383,YANG,Yangri,Jugal,Jugal Himal (N of Phurbi Chhyachu on Tibetan border),6535,21440,8,3,True,False,False,,Opened in 2014,4,1,,0,0,,,,Unclimbed,,,,,383,GEOMETRIC_CENTER,"Zhongba, Xigaze, Tibet, China",ChIJqaLdAdmLuTkRGdFWRV5yGYc,28.142778,85.873889,2,,OK,"establishment,point_of_interest"
384,LCHN,Lachama North,,Changla Himal (N of Lachama Chuli on Tibetan border),6628,21745,17,7,True,False,False,,Opened in 2014,4,1,,0,0,,,,Unclimbed,,,,,384,GEOMETRIC_CENTER,"Na Lachu, 719 00 Slezská Ostrava, Czechia",ChIJbbvC4an8E0cR3It4HppOqwg,30.143333,82.2,1,719 00,OK,route
385,CHNG,Changdi,,Palchung Himal (SE of Kanti Himal peak on Tibetan border),6623,21729,11,7,True,False,False,,Opened in 2014,4,1,,0,0,,,,Unclimbed,,,,,385,GEOMETRIC_CENTER,"Panxian, Liupanshui, Guizhou, China",ChIJH7u3tBhGxDYROUAebihw0IE,29.719167,82.798611,1,,OK,"establishment,point_of_interest"
386,GOLD,Goldum Peak,Pangri Goldumba,Jugal Himal,6632,21759,8,3,True,False,False,,Opened in 2014,4,1,,0,0,,,,Unclimbed,,,,,386,APPROXIMATE,"Gold Dust Peak, Colorado 81632, USA",ChIJ8bRG7lnUQYcRu_Pluj0vJZw,28.328056,85.729167,1,81632,OK,"establishment,natural_feature"
387,THOC,Thoche Go,,Peri Himal (SE of Cheo Himal on Tibetan border),6602,21660,18,5,True,False,False,,Opened in 2014,4,1,,0,0,,,,Unclimbed,,,,,387,APPROXIMATE,"Thoche, Nepal",ChIJJVl8rth9lTkR5LvtPftfQ8Q,28.757778,84.459722,1,,OK,"locality,political"
388,KCHS,Kangchung Shar,"Khangchung, Kangcho Shar, UIAA Peak",Khumbu Himal (NE of Gokyo Lake),6063,19892,12,2,True,False,False,,Opened in 2014,1,2,,1984,3,KCHS84301,Nov 01,Yugoslavia,Francek Knez,Ascents reported by Jan Kielkowski: on 1 Nov 1984 by Francek Knez; on 21 Nov 1984 by Trevor Pilling,,,Nov 01 1984,388,,,,27.983611,86.739722,0,,ZERO_RESULTS,
389,PHUN,Phu Kang North,Phu Khang North,Peri Himal (N of Cheo Himal on Tibetan border),6580,21588,18,5,True,False,False,,Opened in 2014,4,1,,0,0,,,,Unclimbed,,,,,389,ROOFTOP,"5201 NJ-38, Merchantville, NJ 08109, USA",ChIJEQTkRmPJxokRy4Z9khqpQD0,28.820833,84.437778,1,08109,OK,"establishment,food,point_of_interest,restaurant"
390,PTHE,Pethangtse East,,Khumbu Himal (ESE of Pethangtse on Tibetan border),6572,21562,12,2,True,False,False,,Opened in 2014,4,2,,2008,1,PTHE08101,May 16,UK,"Andrew Hughes, Alistair Barnard, Nichcolas Beighton, Chris Fawcett, Daniel Greig-Smith, Benjamin Sherwood",Climbed by British Services Makalu Expedition led by Andrew Hughes,,,May 16 2008,390,,,,27.949444,87.036111,0,,ZERO_RESULTS,
391,PHNG,Phungi,,Peri Himal (SE of Ratna Chuli on Tibetan border),6524,21404,18,5,True,False,False,,Opened in 2014,4,1,,0,0,,,,Unclimbed,,,,,391,APPROXIMATE,"Phungi, Chhattisgarh 497116, India",ChIJaavj7Mq1iTkRnKnSdCBYmJ0,28.83,84.402778,1,497116,OK,"locality,political"
392,KNTE,Kanti Himal East,,Kanti Himal (ENE of Kanti Himal on Tibetan border),6516,21378,11,7,True,False,False,,Opened in 2014,4,1,,0,0,,,,Unclimbed,,,,,392,GEOMETRIC_CENTER,"SRIRUPA CINEMA ROAD,BESIDE SARASWATI CLUB, VILL-HATABARI,, Damodar Pur, Kanthi, Contai, West Bengal 721401, India",ChIJB3jCb_AmAzoRX44mt0SHHT8,29.853056,82.702222,1,721401,OK,"establishment,health,point_of_interest,store"
393,JARK,Jarkya,,Manaslu Himal (N of Larkya La on Tibetan border),6473,21237,15,4,True,False,False,,Opened in 2014,4,1,,0,0,,,,Unclimbed,,,,,393,APPROXIMATE,"Baragaon Jarkhya, Rajasthan, India",ChIJOyc1V8uvbTkRKXF1L5rVPFw,28.741944,84.526944,2,,OK,"locality,political"
394,MARW,Mariyang West,,Kanti Himal (WSW of Mariyang on Tibetan border),6455,21178,11,7,True,False,False,,Opened in 2014,4,1,,0,0,,,,Unclimbed,,,,,394,,,,29.689444,82.828889,0,,ZERO_RESULTS,
395,MAYT,Mayonthang Kang,Mayun Thang Khang,Kanti Himal (NW of Changdi Himal on Tibetan border),6449,21158,11,7,True,False,False,,Opened in 2014,4,1,,0,0,,,,Unclimbed,,,,,395,,,,29.769722,82.746667,0,,ZERO_RESULTS,
396,LNJU,Langju,,Shringi Himal (S of Tobsar),6426,21083,5,4,True,False,False,,Opened in 2014,1,1,,0,0,,,,Unclimbed,,,,,396,APPROXIMATE,"Langjuzhen, Jinxi, Fuzhou, Jiangxi, China",ChIJg5YWYWK8OzQR_QWUQwQqKPE,28.545833,85.055278,1,,OK,"political,sublocality,sublocality_level_2"
397,JYAC,Jyachhung,,Byas Risi Himal (NNW of Nampa on Tibetan border),6338,20794,2,7,True,False,False,,Opened in 2014,4,1,,0,0,,,,Unclimbed,,,,,397,,,,30.106389,81.085833,0,,ZERO_RESULTS,
398,GYLA,Gyala,,Manaslu Himal (NNE of Larkya La on Tibetan border),6363,20876,15,4,True,False,False,,Opened in 2014,4,1,,0,0,,,,Unclimbed,,,,,398,APPROXIMATE,"Đala, Serbia",ChIJCYNO-UiOREcRkpN9wCkUbuA,28.751944,84.558889,1,,OK,"locality,political"
399,DOLM,Dolma Kang,,Rolwaling Himal (SE of Gaurishankar on Tibetan border),6332,20774,19,2,True,False,False,,Opened in 2014,4,1,,0,0,,,,Unclimbed?,,,,,399,,,,27.937222,86.350278,0,,ZERO_RESULTS,
400,KAIP,Kaipuchonam,,Kanti Himal (WNW of Changdi on Tibetan border),6329,20764,11,7,True,False,False,,Opened in 2014,4,1,,0,0,,,,Unclimbed,,,,,400,,,,29.725556,82.783333,0,,ZERO_RESULTS,
401,LDNG,Langdung,,Rolwaling Himal (NE of Kang Nachugo on Tibetan border),6386,20951,19,2,True,False,False,,Opened in 2014,4,1,,0,0,,,,Unclimbed,,,,,401,GEOMETRIC_CENTER,"ĐT972, Chính Lý, Lý Nhân, Hà Nam, Vietnam",ChIJSUZo2yzENTER3eG_3GihSdg,27.947778,86.484167,1,,OK,"establishment,place_of_worship,point_of_interest"
402,DZA2,Dzanye II,,Janak Himal (S of Danzye Peak),6318,20728,6,1,True,False,False,,Opened in 2014,4,2,,2015,3,DZA215301,Oct 04,Japan,"Takanori Mashimo, Kotaro Myatsu, Kenta Kimura, Shinnosuke Ashikari, Shun Katsurai, Takehiro Nozawa",,,,Oct 04 2015,402,,,,27.902222,88.041111,0,,ZERO_RESULTS,
403,PAMA,Pama Himal,,Shringi Himal (N of Chamar on Tibetan border),6300,20669,5,4,True,False,False,,Opened in 2014,4,1,,0,0,,,,Unclimbed,,,,,403,,,,28.580278,84.951111,0,,ZERO_RESULTS,
404,PERH,Peri Himal,,Peri Himal (SE of Cheo Himal on Tibetan border),6296,20656,18,5,True,False,False,,Opened in 2014,4,1,,0,0,,,,Unclimbed,,,,,404,,,,28.747222,84.481667,0,,ZERO_RESULTS,
405,TAKL,Takla Kang,Takla Khang,Kanti Himal (SSE of Kanti Himal peak on Tibetan border),6276,20591,11,7,True,False,False,,Opened in 2014,4,1,,0,0,,,,Unclimbed,,,,,405,,,,29.761111,82.695278,0,,ZERO_RESULTS,
406,KOGI,Kogi Khang North,Kogi Kang North,Kanti Himal (ESE of Kanti Himal peak on Tibetan border),6275,20587,11,7,True,False,False,,Opened in 2014,4,1,,0,0,,,,Unclimbed,,,,,406,,,,29.814444,82.739167,0,,ZERO_RESULTS,
407,ASAJ,Asajya Tuppa,,Gorakh Himal (ENE of Simikot on Tibetan border),6265,20554,17,7,True,False,False,,Opened in 2014,4,1,,0,0,,,,Unclimbed,,,,,407,,,,30.0625,82.279722,0,,ZERO_RESULTS,
