,PEAKID,PKNAME,PKNAME2,LOCATION,HEIGHTM,HEIGHTF,HIMAL,REGION,OPEN,UNLISTED,TREKKING,TREKYEAR,RESTRICT,PHOST,PSTATUS,PEAKMEMO,PYEAR,PSEASON,PEXPID,PSMTDATE,PCOUNTRY,PSUMMITERS,PSMTNOTE,REFERMEMO,PHOTOMEMO,firstsummitdate,Unnamed: 0,accuracy,formatted_address,google_place_id,latitude,longitude,number_of_results,postcode,status,type
154,OMBG,Ombigaichen,Puma Dablam,Khumbu Himal (SE of Ama Dablam),6340,20801,12,2,False,False,True,2002.0,Opened in 2002 as trekking peak,1,2,,1960,3,OMBG60301,Nov 18,"New Zealand, Nepal","Jim Milledge, Ang Tsering Sherpa",,,,Nov 18 1960,154,,,,27.852816,86.883436,0,,ZERO_RESULTS,
155,PUMO,Pumori,,Khumbu Himal (WNW of Everest on Tibetan border),7138,23419,12,2,True,False,False,,,4,2,,1962,1,PUMO62101,May 17,"W Germany, Switzerland","Gerhard Lenser, Ernst Farrer, Ueli Huerlemann, Hans Ruetzel",,,,May 17 1962,155,APPROXIMATE,"Pumori, Khumjung 56000, Nepal",ChIJfVn-DiGs6TkRFQivGAVaJK8,28.0089896,86.8253374,1,56000,OK,"establishment,natural_feature"
156,PUTH,Putha Hiunchuli,Dhaulagiri VII,Dhaulagiri Himal (W of Churen Himal),7246,23773,4,6,True,False,False,,,1,2,,1954,3,PUTH54301,Nov 11,"UK, Nepal","J. O. M. Roberts, Ang Nyima Sherpa",,,,Nov 11 1954,156,APPROXIMATE,"Putha Hiunchuli, Ranmamaikot 21400, Nepal",ChIJa1Si_myRvTkRJhBRJsdZqxI,28.7475,83.1458333,1,21400,OK,"establishment,natural_feature"
157,PYRM,Pyramid Peak,"Pathibhara Chuli, Pathibhara Khas",Jongsang Himal (N of Kangchenjunga on Indian border),7140,23425,7,1,True,False,False,,,5,2,,1993,1,PYRM93101,Apr 24,"Japan, India","Yoshio Ogata, Jot Singh Bhandari, Hiroshi Iwazaki, Phurba Lepcha, Sunder Singh Martolia, Lobsang Sherpa, Nobuhiro Shingo",1st ascent claimed by Swiss (Sutter) in 1949 but reached secondary summit,,,Apr 24 1993,157,APPROXIMATE,"Pyramid Peak, Colorado 81611, USA",ChIJgb28_jBAQIcRgt4vU146wbQ,27.821,88.173,1,81611,OK,"establishment,natural_feature"
158,RAKS,Raksha Urai,Raksha Urai III,Raksha Urai Himal (ESE of Nampa),6609,21683,2,7,True,False,False,,,1,2,,2003,3,RAKS03301,Oct 15,"France, Nepal","Arnaud Clere, Catherine Couland, Gael Faroux, Keshab Raj Gurung",,,,Oct 15 2003,158,,,,29.95,81.116667,0,,ZERO_RESULTS,
159,RAMD,Ramdung,Ramdong Go,Rolwaling Himal (W of Tesi Laptsa),5900,19357,19,2,False,False,True,1978.0,,1,2,,1952,3,RAMD52301,Oct,"UK, Nepal","Tom MacKinnon, Dawa Tenzing Sherpa, Mingma Sherpa",,,,Oct 1952,159,,,,27.8525,86.415711,0,,ZERO_RESULTS,
160,RATH,Rathong,,Simhalila Himal (SW of Kabru on Indian border),6682,21923,9,1,True,False,False,,,5,2,,1964,3,RATH64301,Oct 29,India,"H. P. S. Ahluwalia, Ang Kami Sherpa, Dorje Latoo Sherpa, Nawang Gombu Sherpa",,,,Oct 29 1964,160,GEOMETRIC_CENTER,"Moo 5, Ban Hong, Tambon Ongkharak, Amphoe Pho Thong, Ang Thong, 14120, ตำบล องครักษ์ อำเภอ โพธิ์ทอง อ่างทอง 14120, Thailand",ChIJfWu9Oukc4jARdaHM1NmAGcY,27.593333,88.086667,1,14120,OK,"establishment,place_of_worship,point_of_interest"
161,ROCN,Roc Noir,"Khangsar Kang, Khang Sar Khang",Annapurna Himal (ENE of Annapurna I),7485,24557,1,5,True,False,False,,,1,2,,1969,1,ROCN69101,May 09,W Germany,"Reinhold Obster, Pit Schubert, Karl Winkler",,,,May 09 1969,161,GEOMETRIC_CENTER,"Roc Noir, 30570 Valleraugue, France",ChIJUU71ClqMsxIRF0mnlJPZCFg,28.613422,83.871471,2,30570,OK,route
162,ROKA,Rokapi,Kapchuli,"Api Himal (S of Nampa, Bobaye and Jethi Bahurani)",6468,21220,2,7,True,False,False,,Opened in 2002,1,2,,1977,3,ROKA77301,Oct 10,UK,"Thomas Herley, Kelvin McLane",,,,Oct 10 1977,162,,,,29.8493,81.0405,0,,ZERO_RESULTS,
163,SAIE,Saipal East Humla,,Saipal Himal (NE of Saipal),6925,22720,20,7,True,False,False,,,1,2,,1990,3,SAIP90301,Oct 26,"Switzerland, Nepal","Jacques Montaz, Tendi Sherpa",Saipal East Humla is a subpeak on the NE Ridge of Saipal,,,Oct 26 1990,163,APPROXIMATE,"Saipal, Muchu 10500, Nepal",ChIJd_ddsfR_pDkRrWr5FtpD0ww,29.8891666,81.4941666,1,10500,OK,"establishment,natural_feature"
164,SAIP,Saipal,,Saipal Himal,7030,23064,20,7,True,False,False,,,1,2,,1963,3,SAIP63301,Oct 21,"Japan, Nepal","Katsuotoshi Hirabayashi, Pasang Phutar Sherpa (I)",,,,Oct 21 1963,164,APPROXIMATE,"Saipal, Muchu 10500, Nepal",ChIJd_ddsfR_pDkRrWr5FtpD0ww,29.8891666,81.4941666,1,10500,OK,"establishment,natural_feature"
165,SHAR,Shartse,"Peak 38, Shanti Shikhar",Khumbu Himal (E of Lhotse Shar on Tibetan border),7591,24905,12,2,True,False,False,,,4,1,,0,0,,,,Unclimbed,,,,,165,ROOFTOP,"3500 E 4th St, Long Beach, CA 90814, USA",ChIJ6xjubK8x3YARS2XjjBVHBoU,27.9493,86.9832,1,90814,OK,"establishment,point_of_interest"
166,SHA2,Shartse II,Junction Peak,Khumbu Himal (E of Lhotse Shar on Tibetan border),7457,24465,12,2,True,False,False,,,4,2,,1974,1,SHA274101,May 23,"Austria, W Germany","Kurt Diemburger, Hermann Warth",,,,May 23 1974,166,GEOMETRIC_CENTER,"Block 12, House 33A, Camp, New, New Aruna Colony, Majnu Ka Tilla, New Aruna Nagar, New Delhi, Delhi 110054, India",ChIJ32oWXsX9DDkRkKBZa-k42ho,27.955604,86.96472,1,110054,OK,"establishment,food,point_of_interest,restaurant"
167,SHEY,Shey Shikhar,Junction Peak,Kanjiroba Himal (SE of Kanjiroba and Tripura Hiunchuli),6139,20141,10,7,True,False,False,,,1,2,,2007,2,SHEY07201,Aug 23,Japan,Katsuhito Fujikawa,,,,Aug 23 2007,167,,,,29.286944,82.796389,0,,ZERO_RESULTS,
168,SING,Singu Chuli,Fluted Peak,Annapurna Himal (Annapurna Sanctuary),6501,21329,1,5,False,False,True,1978.0,,1,2,,1957,1,SING57101,Jun 13,UK,"David Cox, Wilfred Noyce",,,,Jun 13 1957,168,APPROXIMATE,"Singu Chuli, Ghandruk 33700, Nepal",ChIJj_oO_AcfvjkR9SNkAq41Kpg,28.583333,83.9,1,33700,OK,"establishment,natural_feature"
169,SISN,Sisne Himal,Hiunchuli Patan,Sisne Himal (SW of Juphal in Rukum),5911,19393,10,7,True,False,False,,,1,2,,2013,1,SISN13101,May 26,"Nepal, USA","Man Bahadur Khatri, Alonzo Lyons, Dbruba Bista, Mulal Gurung, Nilam Gurung, Ali Bahadur Khatri, Vinaya Jaya Malla, Amrit Sarki",,,,May 26 2013,169,GEOMETRIC_CENTER,"DDC Rd, Musikot 22000, Nepal",ChIJydOXAUFbvTkRsGDW8dLlef0,29.783333,80.341667,1,22000,OK,"bus_station,establishment,point_of_interest,transit_station"
170,SITA,Sita Chuchura,,Mukut Himal (ENE of Dhaulagiri II near French Pass),6611,21690,16,6,True,False,False,,,1,2,,1970,3,SITA70301,Oct 26,"Japan, Nepal","Masahiko Takahashi, Hiroshi Harada, Nobuyki Hirato, Phurba Kitar Sherpa",,,,Oct 26 1970,170,GEOMETRIC_CENTER,"Chinsurah R S, Hooghly, West Bengal 712101, India",ChIJY53aaweU-DkRrZ3Qwp3dGV8,28.786,83.4781,2,712101,OK,"establishment,hindu_temple,place_of_worship,point_of_interest"
171,SNOW,Snow Peak,,Dhaulagiri Himal (E of Dhaulagiri II),6530,21424,4,6,False,True,False,,,1,1,,0,0,,,,Unclimbed,,,,,171,ROOFTOP,"410 NW 14th Ave, Portland, OR 97209, USA",ChIJ6xTIlfgJlVQRO2bymm3QQ2I,,,2,97209,OK,"clothing_store,establishment,point_of_interest,store"
172,SPHN,Sphinx,"Pathibhara Phurba, Pathibhara East",Jongsang Himal (NE of Pathibhara on Indian border),6825,22392,7,1,True,False,False,,Opened in 2014,5,2,,1936,1,SPHN36101,Jun,UK,"J. K. Cooke, Frederick S. Chapman, John B. Harrison",,,,Jun 1936,172,APPROXIMATE,"Sphinx, MT 59027, USA",ChIJ36C5sUfeT1MRvCw85OEhxas,27.825,88.188,1,59027,OK,"locality,political"
173,SPHU,Sharphu I,Tanga I,Ohmi Kangri Himal (WNW of Kangchenjunga),6433,21106,6,1,True,False,False,,Opened in 2002,1,2,,1963,3,SPHU63301,Oct 22,Japan,"Takao Ishinabe, Chiharu Miyamoto, Yuzo Tatsumi",,,,Oct 22 1963,173,,,,27.752222,87.916944,0,,ZERO_RESULTS,
174,SURM,Surma-Sarovar North,,Api Himal (SSE of Jethi Bahurani),6564,21535,2,7,True,False,False,,,1,1,,0,0,,,,Unclimbed,,,,,174,GEOMETRIC_CENTER,"88, Rabindra Sarani, Rabindra Sarani, Ram Bagan, Kolkata, West Bengal 700073, India",ChIJh935sst3AjoReQVuTby97Xo,29.65,81.07,1,700073,OK,"clothing_store,establishment,point_of_interest,store"
175,TAWO,Tawoche,Taboche,Khumbu Himal (NW of Ama Dablam),6495,21309,12,2,True,False,False,,,1,2,,1974,1,TAWO74101,Apr 15,France,"Louis Dubost, Paul Gendre",,,,Apr 15 1974,175,APPROXIMATE,"Taboche, Khumjung 56000, Nepal",ChIJDSGZaM2p6TkR1xMtnVTOlK8,27.9038889,86.7716667,1,56000,OK,"establishment,natural_feature"
176,KIRA,Kirat Chuli,Tent Peak,Jongsang Himal (N of Kangchenjunga on Indian border),7362,24154,7,1,True,False,False,,,5,2,,1939,2,KIRA39101,May 29,"Switzerland, Germany","Ernst Grob, Herbert Paidar, Ludwig Schmaderer",,,,May 29 1939,176,APPROXIMATE,Kirat Chuli,ChIJn_O5Fu_45jkReeAo4up1V34,27.7883333,88.1958333,1,,OK,"establishment,natural_feature"
177,THAM,Thamserku,Tramserku,Khumbu Himal (SW of Ama Dablam),6618,21713,12,2,True,False,False,,,1,2,,1964,3,THAM64301,Nov 04,New Zealand,"Lynn Crawford, Peter Farrell, John McKinnon, Richard Stewart",,,,Nov 04 1964,177,APPROXIMATE,"Thamserku, 56000, Nepal",ChIJS7Wa7SsE6TkRcEX8jvQHRFU,27.7895215,86.7856208,1,56000,OK,"establishment,natural_feature"
178,THAR,Tharpu Chuli,Tent Peak,Annapurna Himal (Annapurna Sanctuary),5695,18684,1,5,False,False,True,1978.0,,1,2,,1964,3,THAR64301,Oct 23,Japan,"Masaaki Kimura, Kiyoo Shimada",,,,Oct 23 1964,178,APPROXIMATE,"Tharpu Chuli, Ghandruk 33700, Nepal",ChIJByzg0jAevjkRD-icW-1pJjw,28.5528997,83.881259,1,33700,OK,"establishment,natural_feature"
179,TILI,Tilicho,Tilitso,Annapurna-Nilgiri Himal (N of Annapurna I),7134,23406,1,5,True,False,False,,,1,2,,1978,3,TILI78301,Oct 10,France,Emmanuel Schmutz,Reinhold Messner claimns first ascent in autumn of 1971,,,Oct 10 1978,179,APPROXIMATE,"Tilicho Lake, Khangsar 33500, Nepal",ChIJ5w3IIoUZvjkRyisploijZjs,28.683333,83.856667,1,33500,OK,"establishment,natural_feature"
180,TLNG,Talung,,Simhalila Himal (S of Kangchenjunga on Indian border),7349,24111,9,1,True,False,False,,Opened in 2002,5,2,,1964,1,TLNG64101,May 19,"W Germany, Nepal","Franz Lindner, Tenzing Nanda Sherpa",,,,May 19 1964,180,,,,27.655037,88.131023,0,,ZERO_RESULTS,
181,TONG,Tongu,,Mukut Himal (N of Hongde in Hidden Valley),6187,20299,16,6,False,True,False,,,1,2,,1959,3,TONG59301,Oct 21,USA,"John Humphreys, Fred Dunn, John Noxon",,,,Oct 21 1959,181,APPROXIMATE,"North Tongu, Ghana",ChIJaU3lDKwnIRARFYGg8rE-fWo,,,1,,OK,"administrative_area_level_2,political"
182,TRIP,Tripura Hiunchuli,"Tripura Thumba, Hanging Glacier Peak",Kanjiroba Himal (SE of Kanjiroba),6553,21499,10,7,True,False,False,,,1,2,,1986,3,TRIP86301,Oct 17,"Japan, Nepal","Noriyuki Hata, Katashi Tokimoto, Ang Phuri Sherpa",1st ascent of main (north) peak,,,Oct 17 1986,182,APPROXIMATE,"Tripura Hiunchuli, Kaigaun 21400, Nepal",ChIJdY47PE37vDkRdItukCTO0eE,29.3266666,82.7358333,1,21400,OK,"establishment,natural_feature"
183,TSOK,Tso Karpo Kang,Tso Karpo Khang,Kanjiroba Himal (E of Kanjiroba),6556,21509,10,7,True,False,False,,Opened in 2002,1,2,,1971,3,TSOK71301,Oct 25,Japan,"Shoji Miyoshi, Koji Mizutani",,,,Oct 25 1971,183,,,,29.368611,82.781667,0,,ZERO_RESULTS,
184,TUKU,Tukuche,,Dhaulagiri Himal (NE of Dhaulagiri I),6920,22703,4,6,True,False,False,,,1,2,,1970,1,TUKU70101,Apr 30,Japan,"Hirosuke Kikuchi, Eiho Otani, Takao Yonemoto",1st unofficial ascent by USA in 1968?,,,Apr 30 1970,184,APPROXIMATE,"Tukuche, Nepal",ChIJh6P1CCgGvjkReMRrS-EjccM,28.7768018,83.570964,1,,OK,"locality,political"
185,URKM,Urkinmang,Buddha,Jugal Himal (W of Dorje Lhakpa),6143,20154,8,3,True,False,False,,,1,2,,1964,1,URKM64101,May 20,"Japan, Nepal","Akira Ban, Kazuhisa Jokei, Tesuya Kiyohara, Mingma Tshering Sherpa",,,,May 20 1964,185,,,,28.211667,85.669167,0,,ZERO_RESULTS,
186,ANID,Anidesh Chuli,White Wave Peak,Kangchenjunga Himal (W of Kangbachen),6808,22336,9,1,True,False,False,,Opened in 2002,1,1,,0,0,,,,Unclimbed,,,,,186,,,,27.854444,88.197778,0,,ZERO_RESULTS,
187,TSUR,Tsaurabong Peak,"Chara Ban Peak, White Peak",Dhaulagiri Himal (SSE of Dhaulagiri V),6395,20981,4,6,False,True,False,,,1,2,,1974,1,TSUR74101,,"Japan, Nepal","Genzaburo Yamasaki, Sherpas (?)",,,,,187,ROOFTOP,"74 Sarabongdong-gil, Geonip-dong, Cheju, Jeju-do, South Korea",ChIJBdbgpEDjDDURzYvEtgnodYc,28.695278,83.372778,1,690-050,OK,"establishment,point_of_interest"
188,YALU,Yalung Kang,Yalungkar,Kangchenjunga Himal (W summit of Kangchenjunga),8505,27904,9,1,True,False,False,,,1,2,,1973,1,YALU73101,May 14,Japan,"Yutaka Ageta, Takao Matsuda",1st ascent claimed,,,May 14 1973,188,APPROXIMATE,Jalung Kang,ChIJ3UKSHDdY5jkRJGyibMOk2Ks,27.7052,88.1367,1,,OK,"establishment,natural_feature"
189,PASA,Pasang Lhamu Chuli,Jasemba,Khumbu Himal (W of Cho Oyu & Cho Aui on Tibetan border),7350,24114,12,2,True,False,False,,,4,2,,1986,3,PASA86301,Oct 12,Japan,"Katsushi Emura, Yukitoshi Endo, Katsuo Matsuki, Yoshihiro Shikoda",,,,Oct 12 1986,189,,,,28.073333,86.614167,0,,ZERO_RESULTS,
190,RATC,Ratna Chuli,,Peri Himal (NW of Himlung on Tibetan border),7035,23081,18,5,True,False,False,,Opened in 2002,4,2,,1996,3,RATC96301,Oct 14,"Japan, Nepal","Osamu Tanabe, Santa Bahadur Ale, Katsuhiko Sawada, Durge Bahadur Tamang, Tul Bahadur Tamang",,,,Oct 14 1996,190,APPROXIMATE,"Ratna Chuli, Xigaze, Nepal",ChIJf0WKTWvJvzkRnmgzmjVG1Is,28.8641666,84.375,1,,OK,"establishment,natural_feature"
191,KANT,Kanti Himal,"Ronglai Kangri, Kaqur Kangri, Kubi Grangri",Kanti Himal (NNW of Kanjiroba on Tibetan border),6850,22474,11,7,True,False,False,,Opened in 2002,4,2,,2002,3,KANT02301,Sep 24,"Japan, Nepal","Toyoji Wada, Katsumi Nishida, Atsushi Senda, Hyosuke Tsuboi, Yusuke Ueda, Ang Mingm Sherpa, Karchen Dawa Sherpa, Nga Dorje Sherpa",Ascent was from Tibetan side,,,Sep 24 2002,191,GEOMETRIC_CENTER,"26 Veer Savarkar Block 663, Aggarwal Chamber III IV Floor, Vikas Marg, Shakarpur, Shakarpur, Block A, Shakarpur, New Delhi, Delhi 110054, India",ChIJRQtaUq38DDkRSJVAsRaiWHw,29.835833,82.647778,1,110054,OK,"establishment,lawyer,point_of_interest"
192,RAMT,Ramtang,,Kangchenjunga Himal (N of Kangbachen),6601,21657,9,1,True,False,False,,Opened in 1997,1,2,,1930,1,RAMT30101,May,"Austria, UK","Erwin Schneider, Frank Smythe",,,,May 1930,192,APPROXIMATE,"Ramthang, Sikkim 737119, India",ChIJKT0QdHC85jkROqUMTY4ZYdA,27.75,88.085,1,737119,OK,"locality,political"
193,LING,Lingtren,,Khumbu Himal (ENE of Pumori on Tibetan border),6713,22024,12,2,True,False,False,,Opened in 2002,4,2,,1935,2,LING35201,Aug,UK,"Eric Shipton, Dan Bryant",,,,Aug 1935,193,APPROXIMATE,"Lingtren, Xigaze, Nepal",ChIJi4H9G1Os6TkREC_D6sISQ9M,28.027778,86.855,1,,OK,"establishment,natural_feature"
194,TENG,Tengkoma,Tang Kongma,Jongsang Himal (NW of Kangchenjunga),6215,20390,7,1,True,False,False,,Opened in 1997,1,2,,1949,1,TENG49101,Jun 17,"Switzerland, Nepal","Alfred Sutter, Rene Dittert, Annelies Lohner, Jacob Pargaetzi-Almer, Edouard Wyss-Dunant, Pasang Sherpa",,,,Jun 17 1949,194,,,,27.809,88.074,0,,ZERO_RESULTS,
195,RAMC,Ramtang Chang,"Wedge Peak, Chang Himal",Kangchenjunga Himal (N of Ramtang),6802,22316,9,1,True,False,False,,Opened in 2002,1,2,,1974,3,RAMC74301,Oct 05,Yugoslavia,"Janez Gradisar, Bojan Pollak, Michael Smolej",Illegal ascent,,,Oct 05 1974,195,,,,27.766,88.084,0,,ZERO_RESULTS,
196,CHRE,Churen Himal East,,Dhaulagiri Himal (NW of Dhaulagiri VI),7371,24183,4,6,True,False,False,,One permit for Churen Himal's three summits,1,2,,1970,1,CHRE70101,Apr 29,"S Korea, Nepal","Kim Ho-Sup, Rinsing Ongyal Sherpa",,,,Apr 29 1970,196,APPROXIMATE,"Churen Himal, Gurja Khani 21400, Nepal",ChIJl2a5HFOSvTkRyGC7exbhYqM,28.735,83.2166666,1,21400,OK,"establishment,natural_feature"
197,CHRW,Churen Himal West,,Dhaulagiri Himal (NW of Dhaulagiri VI),7371,24183,4,6,True,False,False,,One permit for Churen Himal's three summits,1,2,,1970,3,CHRW70301,Oct 28,"Japan, Nepal","Kozo Hasegawa, Ang Norbu Sherpa",,,,Oct 28 1970,197,,,,28.731755,83.210059,0,,ZERO_RESULTS,
198,CHRI,Chhukung Ri,,Khumbu Himal (S of Lhotse),5550,18209,12,2,False,False,True,2002.0,Opened in 1997; converted to trekking peak in 2002,1,2,,1965,1,CHRI65101,May,Netherlands,Johannes Adolf Noordijk,,,,May 1965,198,,,,27.926057,86.879196,0,,ZERO_RESULTS,
199,KTOK,Kangtokal,Khang Tokal,Dhaulagiri Himal (on ridge N of Putha Hiunchuli),6294,20650,4,6,True,False,False,,Opened in 1997,1,2,,1962,1,KTOK62101,Jun 06,"Japan, Nepal","Zenkichi Hirayama, Ang Temba Sherpa",,,,Jun 06 1962,199,,,,28.801389,83.168889,0,,ZERO_RESULTS,
200,SRKU,Serku Dolma,,Kanjiroba Himal (S of Tso Karpo Kang),6227,20430,10,7,False,True,False,,,1,2,,1973,3,SRKU73301,Oct 30,"Japan, Nepal","Eiken Moriyama, Morihiro Takechi, Anu Sherpa",,,,Oct 30 1973,200,,,,,,0,,ZERO_RESULTS,
201,NALS,Nalakankar South,,Nalakankar Himal (on W Nepal/Tibetan border),6024,19764,17,7,False,True,False,,,4,2,,2000,2,NALS00201,Jul 07,"Japan, Nepal","Tamotsu Ohnishi, Takehiko Yanagihara, Chuldim Nuru Sherpa, Kancha Dawa Sherpa",,,,Jul 07 2000,201,APPROXIMATE,"Kalakankar, Uttar Pradesh 229408, India",ChIJtfhgCW8YmzkRnXJULTRPlA0,30.266667,81.435556,1,229408,OK,"locality,political"
202,CHWT,Changwathang,,Chandi Himal (S of Tibetan border),6130,20112,17,7,True,False,False,,Opened in 2002,1,2,,2000,2,CHWT00201,Jun 28,"Japan, Nepal","Tamotsu Ohnishi, Koji Mizutani, Nobuo Akayama, Takehiko Yanagihara, Chuldim Nuru Sherpa, Dawa Sherpa",,,,Jun 28 2000,202,,,,30.326667,81.885,0,,ZERO_RESULTS,
203,TAKP,Takphu Himal,,Nalakankar Himal (on W Nepal/Tibetan border),6395,20981,17,7,True,False,False,,Opened in 2003,4,1,,0,0,,,,Unclimbed,,,,,203,,,,30.283889,81.417778,0,,ZERO_RESULTS,
204,MALA,Malanphulan,"Melanpulan, Hinku Ri","Khumbu Himal (S of Ama Dablam, NW of Kangtega)",6573,21565,12,2,True,False,False,,Opened in 2014,1,2,,2000,1,MALA00101,Apr 28,USA,"Peter Carse, Amy Bullard",,,,Apr 28 2000,204,,,,27.802778,86.872222,0,,ZERO_RESULTS,
205,LHOM,Lhotse Middle,Lhotse Intermediate,Khumbu Himal (E of Lhotse),8410,27592,12,2,True,False,False,,Opened in 2001,4,2,,2001,1,LHOM01101,May 23,Russia,"Sergei Timofeev, Alexei Bolotov, Piotr Kouznetsov, Evgeni Vinogradski",,,,May 23 2001,205,APPROXIMATE,Lhotse,ChIJpRBEqI1U6DkRbC8oXKc-sVs,27.961089,86.938023,1,,OK,"establishment,natural_feature"
206,SIMN,Simnang Himal,"P2, Simnang Himal East",Manaslu Himal (SE of Manaslu),6251,20509,15,4,True,False,False,,Opened in 2001,1,2,,2001,1,SIMN01101,May 16,Ukraine,"Mistislav Gorbenko, Vadim Leontiev, Sergei Pugachov, Mykhaylo Zagirnyak",,,,May 16 2001,206,,,,28.51651,84.64495,0,,ZERO_RESULTS,
207,HCHI,Hungchhi,"Hunchhi, Chakung, Gyubanare Kang, Gyuba Tshomotse",Khumbu Himal (S of Gyachung Kang on Tibetan border),7029,23061,12,2,True,False,False,,Opened in 2001,4,2,,2003,1,HCHI03102,Apr 19,"Japan, Nepal","Katsuo Fukuhara, Tadashi Morita, Kanji Shimizu, Durga Rai, Hit Bahadur Tamang, Ram Kaji Tamang, Tul Bahadur Tamang",,,,Apr 19 2003,207,APPROXIMATE,"Hungchhi, Xigaze 56000, Nepal",ChIJH6q6Fpmv6TkRgy0PXKviwa4,28.035,86.7583333,1,56000,OK,"establishment,natural_feature"
208,LAMP,Lampo,"Langpo Kangri, Ganesh VI",Ganesh Himal (N of Ganesh I on Tibetan border),6648,21811,5,4,False,True,False,,,4,1,,0,0,,,,Unclimbed,,,,,208,ROOFTOP,"205 Monticello Rd, Charlottesville, VA 22902, USA",ChIJ86UIySCGs4kRfXW0m8HgeYU,28.497983,85.157144,1,22902,OK,"establishment,food,point_of_interest,restaurant"
209,CHUK,Chhukung Tse,Chhukung Chuli,Khumbu Himal (S of Lhotse),5833,19137,12,2,False,False,True,,,1,2,,1953,1,CHUK53101,Apr 03,"UK, Nepal","John Hunt, Tenzing Norgay Sherpa",,,,Apr 03 1953,209,,,,27.938982,86.87466,0,,ZERO_RESULTS,
210,DZAN,Dzanye,Dzanaye,Janak Himal (WNW of Lashar I on Tibetan border),6581,21591,6,1,True,False,False,,,4,2,,1949,1,DZAN49101,Jun 30,Switzerland,"Alfred Sutter, Rene Dittert, Annelies Lohner, Jacob Pargaetzi-Almer, Edouard Wyss-Dunant",,,,Jun 30 1949,210,,,,27.906111,88.026667,0,,ZERO_RESULTS,
211,GAUG,Gaugiri,,Damodar Himal (N of Bhrikuti on Tibetan border),6110,20046,3,5,True,False,False,,Opened in 2002,4,2,,2002,1,GAUG02101,May 28,USA,"Peter Ackroyd, Jim Frush",,,,May 28 2002,211,,,,29.046,84.188,0,,ZERO_RESULTS,
212,TKPO,Tengkangpoche,Thyangmoche,Rolwaling Himal (W of Kwangde),6482,21266,19,2,True,False,False,,Opened in 2001,1,2,,1984,3,TKPO84301,Oct,"UK, USA","Trevor Pilling, Andy Zimet",,,,Oct 1984,212,,,,27.803968,86.59647,0,,ZERO_RESULTS,
213,ARNK,Arniko Chuli,Araniko Chuli,Mukut Himal (W Mustang near Tibetan border),6034,19797,16,6,True,False,False,,Opened in 2002,4,2,,2002,2,ARNK02201,Jul 10,"Japan, Nepal","Tamotsu Ohnishi, Ang Phurba Sherpa, Dikki Sherpa",,,,Jul 10 2002,213,,,,29.176389,83.656944,0,,ZERO_RESULTS,
214,SARI,Saribung,Selibung,Damodar Himal (W of Bhrikuti),6328,20761,3,5,True,False,False,,Opened in 2002,1,2,,2003,3,SARI03301,Oct 15,USA,"Jim Frush, Steve Furman",,,,Oct 15 2003,214,,,,28.885,84.172,0,,ZERO_RESULTS,
215,GHEN,Ghenge Liru,"Ghenye Lirung, Langtang II",Langtang Himal (WSW of Langtang Lirung),6596,21640,13,3,True,False,False,,Opened in 2002,1,2,,1963,1,GHEN63101,May 28,"UK, Nepal","Peter Taylor, Pasang Sherpa, Pasang Phutar Sherpa (I)",,,,May 28 1963,215,GEOMETRIC_CENTER,"La ville au Bois, 77160 Saint-Hilliers, France",ChIJPzHu5Ms170cRgTYas_qZZrc,28.245833,85.422778,1,77160,OK,"establishment,point_of_interest"
216,NAUL,Naulekh,,Khumbu Himal (S of Mera Peak),6340,20801,12,2,True,False,False,,Opened in 2002,1,2,,1954,1,NAUL54101,Jun 08,New Zealand,"Colin Todd, Bill Beaven",,,,Jun 08 1954,216,,,,27.686667,86.9,0,,ZERO_RESULTS,
217,CHEK,Chekigo,,Rolwaling Himal (ENE of Beding village on Tibetan border),6121,20082,19,2,False,False,True,2002.0,Opened in 2002 as trekking peak,4,2,,2005,1,CHEK05101,May 15,"UK, Switzerland","Bruce Normand, Oliver von Rotz",1st known ascent,,,May 15 2005,217,,,,27.832,86.45,0,,ZERO_RESULTS,
218,KTUN,Khatung Khang,,Annapurna-Nilgiri Himal (SW of Thorong La),6484,21273,1,5,True,False,False,,Opened in 2002,1,2,,1956,1,KTUN56101,Apr 12,Switzerland,"Arthur Baumgartner, Marguerite Deriaz",,,,Apr 12 1956,218,APPROXIMATE,"Khong Khong Basti, Assam 782446, India",ChIJ--vhW15uRTcRvvqxd0Dcnj8,28.660556,84.019306,1,782446,OK,"locality,political"
219,CHAG,Chago,,Makalu Himal (NW of Makalu II on Tibetan border),6893,22615,14,2,True,False,False,,Opened in 2002,4,2,,1954,1,CHAG54101,May 29,"New Zealand, Nepal","Michael Ball, Urkien Sherpa",,,,May 29 1954,219,ROOFTOP,"123 Washington Blvd, Montebello, CA 90640, USA",ChIJDQ2w8crPwoARs_NXhSzVBMg,27.926053,87.054029,1,90640,OK,"establishment,food,point_of_interest,restaurant"
220,NUMR,Numri,,"Khumbu Himal (S of Cho Polu, N of Baruntse)",6635,21768,12,2,True,False,False,,Opened in 2002,1,2,,2002,3,NUMR02301,Nov 07,Germany,"Olaf Rieck, Carsten Schmidt, Lydia Schubert",,,,Nov 07 2002,220,,,,28.022222,86.800833,0,,ZERO_RESULTS,
221,PK41,Peak 41,"""True"" Mera Peak",Khumbu Himal (ESE of Ama Dablam),6648,21811,12,2,True,False,False,2002.0,Opened in 2002,1,2,,2002,3,PK4102301,Oct 16,Slovenia,"Matic Jost, Urban Golob, Uros Samec",Rumored that two Americans and two Swiss (and possibly others) summited in earlier years,,,Oct 16 2002,221,RANGE_INTERPOLATED,"41 Peak Blvd, Muskogee, OK, USA",Eh80MSBQZWFrIEJsdmQsIE11c2tvZ2VlLCBPSywgVVNB,27.774,86.909,7,,OK,street_address
222,KYAZ,Kyazo Ri,Kyajo Ri,Khumbu Himal (SW of Gokyo Lake),6151,20180,12,2,False,False,True,2002.0,Opened in 2002 as trekking peak,1,2,,2002,3,KYAZ02301,Oct 20,"UK, France","Duncan Wilson, Vincent Marche",,,,Oct 20 2002,222,APPROXIMATE,"Kyajo Ri, Namche 56000, Nepal",ChIJCz84-jen6TkR2UlkepCIpow,27.9070584,86.6381836,1,56000,OK,"establishment,natural_feature"
223,PAND,Pandra,,Ohmi Kangri Himal (NW of Lhonak),6670,21883,6,1,True,False,False,,Opened in 2002,1,2,,2002,3,PAND02301,Oct 16,Denmark,"Allan Christensen, Bo Belvedere Christensen, Jan Mathorne",,,,Oct 16 2002,223,APPROXIMATE,"Pandra, Jharkhand, India",ChIJiQ-oMqTg9DkRH5Ol9DO4bcU,27.864,87.993 ,1,,OK,"locality,political"
224,DANG,Danga,,"Ohmi Kangri Himal (WNW of Lhonak, E of Nupchu)",6220,20407,6,1,True,False,False,,Opened in 2002,1,2,,2002,3,DANG02301,Oct 20,Denmark,"Allan Christensen, Bo Belvedere Christensen, Jan Mathorne",,,,Oct 20 2002,224,ROOFTOP,"91 Randhurst Village Dr #117, Mt Prospect, IL 60056, USA",ChIJBzMepiC6D4gRkysMewhKfTc,27.816,87.977,2,60056,OK,"establishment,health,point_of_interest"
225,POKR,Pokharkang,Pokhar Khang,Damodar Himal (N of Pisang Peak),6372,20906,3,5,True,False,False,,Opened in 2002,1,2,,2002,3,POKR02301,Nov 17,"UK, Nepal","Richard Scott, Dave Wynne-Jones, Kaji Sherpa","Japanese team led by Koichi Kato climbed NW Smt on Oct 31, 2002 [which they thought was the highest]",,,Nov 17 2002,225,,,,,,0,,ZERO_RESULTS,
226,NAG1,Nangpai Gosum I,"Nagpai Gosum I, Cho Aui",Khumbu Himal (WSW of Cho Oyu on Tibetan border),7321,24019,12,2,True,False,False,,Opened in 2002,4,1,,0,0,,,,Unclimbed,,,,,226,APPROXIMATE,"Nangpai Gosum, Xigaze 56000, Nepal",ChIJMSq66iy96TkRI-85rxg9IOQ,28.07358,86.614393,1,56000,OK,"establishment,natural_feature"
227,KGRI,Khangri Shar,,Khumbu Himal (W of Pumori),6792,22283,12,2,True,False,False,,Opened in 2002,1,1,,0,0,,,,Unclimbed,,,,,227,,,,28.02,86.812,0,,ZERO_RESULTS,
228,KGRW,Khangri West,,Khumbu Himal (W of Pumori),6658,21844,12,2,True,False,False,,Opened in 2002,1,1,,0,0,,,,Unclimbed,,,,,228,APPROXIMATE,"Khangri, Rajasthan, India",ChIJKwPtQ--LQjkRF421UlG-19w,28.019241,86.790461,1,,OK,"locality,political"
229,PURB,Purbung Himal,Putrung,Damodar Himal (N of Chulu West),6500,21325,3,5,True,False,False,,Opened in 2002,1,1,,0,0,,,,Unclimbed,,,,,229,,,,28.802,84.018,0,,ZERO_RESULTS,
230,TASH,Tashi Kang,Tashi Khang,Mukut Himal (N of Dhampus Peak),6386,20951,16,6,True,False,False,,Opened in 2002,1,2,,2002,2,TASH02201,Aug 14,"Japan, Nepal","Yasue Mogi, Gyalzen Sherpa",,,,Aug 14 2002,230,GEOMETRIC_CENTER,"Tashi Line, Zhuanghe Shi, Dalian Shi, Liaoning Sheng, China",ChIJKWwkfMsGKl4RJpFrynWQ5Eg,28.853,83.629,2,,OK,"establishment,health,pharmacy,point_of_interest,store"
231,TENR,Tengi Ragi Tau,"Agole, Angole",Rolwaling Himal (N of Tesi Laptsa),6938,22762,19,2,True,False,False,,Opened in 2002,1,2,,2002,4,TENR02401,Dec 04,"Japan, Nepal","Koichi Ezaki, Ruchia Takahashi, Pasang Tamang, Tul Bahadur Tamang",,,,Dec 04 2002,231,APPROXIMATE,"Tengi Ragi Tau, Namche, Nepal",ChIJ_4IzQRN16TkRg9ca5fitCMg,27.8575,86.5541666,1,,OK,"establishment,natural_feature"
